{
  "$schemaRef": "./schemas/effects.schema.json",
  "version": 1,
  "updated": "2026-07-29",
  "description": "Effect-link graph: 'change A => must review/change B'. Seeded with architecture invariants; grows as code lands (see protocols/effect-link.md).",
  "links": [
    {
      "id": "E-001",
      "from": {
        "kind": "contract",
        "ref": "@tessera/storage:ports (RelationalStore|VectorStore|BlobStore|Queue)"
      },
      "to": [
        {
          "kind": "module",
          "ref": "@tessera/storage:adapters/* (sqlite, sqlite-vec, filesystem, in-proc; postgres + pgvector REALIZED F-023/ADR-0026; later s3, bullmq)"
        },
        {
          "kind": "test",
          "ref": "@tessera/storage:conformance-suite"
        },
        {
          "kind": "decision",
          "ref": "docs/adr/0003-local-first-cloud-ready-ports-and-adapters.md"
        },
        {
          "kind": "contract",
          "ref": "every storage/domain PORT now has at least two real adapters (F-056), which is what turns \"ports and adapters\" from an intention into a checked property: MemoryStore, GraphStore, BlobStore, Queue, KeywordRetriever, TemporalRetriever, IngestionManifest, SourceRegistry, ProjectStore, TokenStore and AuditLog each pass the SAME shared conformance suite on SQLite/filesystem/in-process AND on Postgres/S3/BullMQ. Two of those suites (audit log, project store) were previously reachable only by their in-memory reference adapters and now ship on `@tessera/api/conformance`; the source registry likewise on `@tessera/ingestion/conformance`."
        }
      ],
      "kind": "EFFECT_LINK",
      "rationale": "A storage port is implemented by every adapter and validated by one shared conformance suite; changing the interface breaks all adapters and the suite, and a semantic change needs an ADR. F-037 (ADR-0033) added VectorStore.forTenant (per-tenant row isolation): sqlite-vec uses a per-tenant vec0 table, pgvector a tenant column + composite PK; both satisfy the shared vector conformance's isolation case (pgvector verified live).",
      "confidence": 1,
      "origin": "manual"
    },
    {
      "id": "E-002",
      "from": {
        "kind": "contract",
        "ref": "@tessera/knowledge-graph:effect-link & node/edge model"
      },
      "to": [
        {
          "kind": "symbol",
          "ref": "@tessera/knowledge-graph:get_effects"
        },
        {
          "kind": "module",
          "ref": "@tessera/retrieval:graph-retriever"
        },
        {
          "kind": "module",
          "ref": "@tessera/web graph & effects views — REALIZED F-043: /graph (GraphView) is an explorable React Flow view of GET /v1/graph with a mode toggle (Explore | Effects), node-kind filters, search-to-focus, and a side panel; Effects mode highlights get_effects paths (FR-19) + lists ranked dependents (distance/score/path). A pure toFlow() maps domain nodes/edges → Flow (kind-clustered grid, effect-link styling, path highlight; 5k-node LOD budget). React Flow is lazy/ssr:false/code-split; the side panel is the keyboard-accessible alternative. Consumes /v1/graph + /v1/effects via lib/api (E-003)"
        },
        {
          "kind": "schema",
          "ref": ".harness/state/schemas/effects.schema.json"
        }
      ],
      "kind": "EFFECT_LINK",
      "rationale": "The KG/effect-link model feeds graph retrieval, get_effects, and the dashboard; the harness effects schema mirrors the product model, so changing one should be reflected in the others. F-043 realized the web graph & effects views (React Flow) over a new read-only GET /v1/graph query surface (E-011) — so changing the node/edge/effect model or the graph query ripples to the visualization.",
      "confidence": 0.9,
      "origin": "manual"
    },
    {
      "id": "E-003",
      "from": {
        "kind": "contract",
        "ref": "REST /v1 + MCP tool contracts (@tessera/api, @tessera/mcp)"
      },
      "to": [
        {
          "kind": "module",
          "ref": "@tessera/api route Zod schemas (apps/api/src/schemas/*) — the single source for validation + serialization + OpenAPI"
        },
        {
          "kind": "artifact",
          "ref": "generated OpenAPI document (GET /v1/openapi.json via @fastify/swagger)"
        },
        {
          "kind": "module",
          "ref": "@tessera/mcp tools (apps/mcp/src/server.ts: search/compile_context/get_effects/capture_memory/explain) — wrap the SAME domain services as REST via a type-only ApiServices import (F-012, one engine/two surfaces); now optionally gated by an injected McpGateway (F-026) that authenticates + authorizes (RBAC) + meters quotas per call before the service runs (ADDITIVE — default off, tool input/output unchanged)"
        },
        {
          "kind": "module",
          "ref": "the shared error envelope now includes RATE_LIMITED (F-026, @tessera/core) — the REST statusForCode/codeForStatus map it to 429 and errorCodeSchema lists it; MCP's toEnvelope surfaces it as a 4xx-safe code"
        },
        {
          "kind": "package",
          "ref": "@tessera/sdk (generated TS client, F-022 REALIZED, ADR-0025): types GENERATED from GET /v1/openapi.json via openapi-typescript (committed src/generated/schema.ts + a reproducible generate script) + a thin openapi-fetch client (createTesseraClient) mapping the {error} envelope to TesseraApiError. A route/schema change ⇒ regenerate the SDK types (tsc catches drift). Supersedes apps/web/lib/api once the web app adopts it (ADR-0022, deferred)"
        },
        {
          "kind": "module",
          "ref": "@tessera/web dashboard (F-014, realized): search + Context Package Inspector consume POST /v1/search & /v1/compile via the interim typed client apps/web/lib/api (ADR-0022)"
        },
        {
          "kind": "module",
          "ref": "@tessera/api GET /v1/events SSE stream (F-021, FR-38) over an injected ApiEventBus (buildServer option, default in-process) — ADDITIVE, REST-only (MCP unaffected); the memory-capture route emits memory.captured; document.ingested/removed types are provided, the ingestion-worker producer is wired via the composition root later. OpenAPI regenerates to include /v1/events"
        },
        {
          "kind": "module",
          "ref": "@tessera/api /v1 auth guard (F-025): registerAuth (onRequest → request.authContext via the injected AuthProvider) + requirePermission per-route preHandlers add 401/403 paths to the existing routes — ADDITIVE (response schemas + OpenAPI unchanged; auth defaults to the zero-auth Local provider so existing routes/e2e are untouched). The full auth/tenancy/RBAC contract is E-018"
        },
        {
          "kind": "module",
          "ref": "@tessera/api /v1/billing routes (F-030): plans (public) / subscription + checkout (admin:manage) / webhook (public, signature-verified via a raw-body scope) over the @tessera/billing BillingProvider — ADDITIVE; new billing schemas → the OpenAPI doc + generated @tessera/sdk were regenerated. See E-019"
        },
        {
          "kind": "decision",
          "ref": "docs/adr/0016-rest-api-fastify-zod-bridge.md"
        },
        {
          "kind": "decision",
          "ref": "docs/adr/0017-mcp-server-surface.md"
        },
        {
          "kind": "module",
          "ref": "@tessera/api hardening (F-044): cross-cutting security applied via plugins — security headers (CSP default-src none + frame-ancestors none, X-Frame-Options DENY, nosniff, no-referrer; HSTS behind a TLS flag), per-principal (fallback per-IP) rate limiting on /v1 (RateLimiter port + in-memory fixed-window adapter → RATE_LIMITED 429 + RateLimit-Limit/Remaining/Reset + Retry-After), a per-profile CORS allowlist replacing the blanket loopback policy (ADR-0035), and request-id correlation (sanitized inbound x-request-id else req_<uuid>, echoed + bound into logs). ADDITIVE — no route/schema shape change, so the OpenAPI doc / @tessera/sdk / dashboard are unaffected; buildServer gains security?/cors?/rateLimit? options. GET /v1/events (SSE) now authenticates under a non-none provider (no bypass). See E-024"
        },
        {
          "kind": "module",
          "ref": "@tessera/api GET /v1/me (F-045): a new authenticated route projecting the resolved AuthContext to {principal:{id,kind,roles,displayName?},tenantId,permissions}; regenerated the OpenAPI doc + @tessera/sdk (openapi-typescript). ADDITIVE (no existing route/schema changed). The SDK gained me/getPlans/getHealth/getReady (getReady returns the 503 body as data)."
        },
        {
          "kind": "module",
          "ref": "@tessera/web now consumes the GENERATED @tessera/sdk (F-045, closes ADR-0022): apps/web/lib/api is a thin adapter over createTesseraClient pointed at a same-origin Next proxy (/api/tessera); the TanStack Query hook surface + view components are unchanged (the ADR-0022 drop-in). A route/schema change ⇒ regenerate the SDK ⇒ the dashboard client updates."
        },
        {
          "kind": "module",
          "ref": "New REST routes GET /v1/rbac + GET/POST/DELETE /v1/tokens (F-046) ⇒ regenerated OpenAPI + @tessera/sdk (getRbac/listTokens/createToken/revokeToken + getSubscription); ADDITIVE (no existing route changed). The dashboard /profile page + token panel consume them through the same-origin proxy."
        },
        {
          "kind": "module",
          "ref": "@tessera/api /v1/dsr/export + /v1/dsr/delete + /v1/retention + /v1/retention/prune (F-047; NFR-13/FR-15) — admin:manage-guarded, audited, tenant-of-the-caller only (never a tenant id off the wire). buildServer gains memoryRetention?; apps/server passes runtime.memoryRetention. The DSR bundle schema is COMPOSED from the existing memory/graph/sources/audit schemas, so an export can never drift from the live surface."
        },
        {
          "kind": "package",